	alright . [+ exc] 1828_2842
	the little boy [//] girl's reaching up there and she's got her
	and the boy's <on a stool> [//] standing on a stool but its gonna
	he's reaching for cookies . 9902_11373
	and the mother has their [: her] [* s:r] back to (th)em . 11373_13268
	she doesn't see them but her [//] she hasn't payed any attention to
	it's running all over the place . 16250_17657
	her window is open and there's a nice garden and a garage out back
	she's drying some dishes . 21747_23760
	she has an apron on . 23760_24957
	her &s dress is sleeveless . 24957_26587
	has a pretty nice kitchen like &uh pretty nice curtains on it .
	and &um <the jar> [//] the cookie jar lid is off . 33013_39221
	she has a couple cups and she has a couple plates but she better
	the little girl has socks and shoes on and a short dress and <long
	and the boy has his shorts on and a short sleeved s:irt [: shirt]
	trees are in bloom outside and the flowers out there . 61757_65617
