	well I see the sink overflowin(g) . 0_5117
	the mother is doing the dishes . 5117_7503
	<the children are> [//] the boy is up on the &s stool . 7503_15923
	and the stool's falling over but he's grabbing cookies out_of the
	and the girl is reaching up for a cookie . 20235_26489
	the window seems to be open xxx . 26489_35035
	and the woman is standing in water . 35035_37540
	and the cookie jar lid is off [//] falling off . 37540_50910
	the water's runnin(g) . 59253_63144
