	&um a boy and a girl are in the kitchen with their mother . 8359_14942
	and the little boy is getting a cookie for the little girl but he's
	&uh the mother is washing dishes . 23426_26618
	and she's obviously thinking of something else because the water's
	she's finished with some of the dishes . 34167_36355
	it seems to be summertime because there are bushes . 36355_38972
	the window is open . 38972_40685
	there seems to be some kind of a breeze because the curtains on the
	must be fairly hot . [+ gram] 46138_48017
	the mother's in a sleeveless dress . 48017_50693
	the children are in [/] in short sleeve &um tops and have sandals .
	the little boy has &uh tennis shoes on . 58539_62132
	&um the mother obviously is unaware of what the children are doing
	she's going to be aware of it very shortly . 67187_69447
	&um I_mean how much more do you want ? [+ exc] 69447_73039
	+< hm okay . [+ exc] 73500_75032
