	well for one thing the boy is stealing cookies . 8888_13279
	and the girl is asking for a cookie . 13279_16545
	and the boy is standing on a (.) stool which is tipping over . 16545_21370
	and the lady's drying a plate . 21370_24795
	and the (.) water is running in the sink and overflowing on the
	and the window is open . 34007_37742
	and (.) I don't know that there's anything special going on outside
	seems to me <that> [/] &uh that's essentially the things that are
	the girl is picking her nose . 54613_58830
	the boy is handing her a cookie . 61868_64698
	(.) &uh really those are the only activities I see . [+ exc] 64510_74923
