	well the girl is watching the boy go into the cookie jar . 3038_9775
	he has a cookie in his hand . 9775_11814
	he's on the stool . 11814_13590
	the <stool is> [/] stool is falling . 13590_16391
	the mother is drying dishes . 16391_21311
	has a plate in her hand . [+ gram] 21311_23505
	sink is overflowing . [+ gram] 23505_25301
	there's water on the floor . 25301_27431
	she's stepping in the water . 27363_29980
	something that's going on you said ? [+ exc] 29980_33950
	<she looks> [//] the little girl looks like she's motioning to the
	and &uh (.) I don't know what else . [+ exc] 41761_49587
	the woman's looking out the window . 49587_51781
	the window's open . 51781_56352
