	oh I remember this one . [+ exc] 2354_4914
	okay . [+ exc] 4914_5463
	the mom's doing the dishes and looking out the window . 5463_8159
	and she must be really interested in what she sees out there
	and meantime behind her the kids are getting up on the stool and
	the left hand side of the cupboard door is open . 24595_26911
	&uh the little girl has her finger on her lips &uh &s telling him
	and &uh action [/] action . [+ exc] 39312_42421
	the water running . [+ gram] 42421_43152
	the mama's drying a dish . 43152_44669
	that's what she's doing and looking out the window . 44669_49324
	little boy has taken one cookie out_of the cookie jar and is about
	and he is reaching into the cookie jar for another cookie . 59848_62928
	and action [/] action . [+ exc] 62928_69046
	well the curtains are blowing in the breeze . 69046_76728
	I guess that's an action . [+ exc] 76728_77740
	it looks as though they are . 77740_78939
	&um no action as far as I can see out the window . 78939_85222
	the window's open (.) which implies an action earlier . 85222_91109
	I can't see any more action in it . [+ exc] 91109_94407
