	everything that I see going on . [+ exc] 0_3257
	okay . [+ exc] 3257_6399
	well a little boy is stealing a cookie from the cookie jar . 6399_13138
	he's also handing a cookie with his left hand to the girl . 13138_18274
	he's also falling off a stool or the stool is tipping over . 18274_24467
	the little girl is reaching for the cookie . 24467_27890
	at the same time she's picking her nose or something &=laughs . 27890_30863
	I don't know what's she's doing &=laughs . [+ exc] 30863_32900
	&=laughs &uh (.) it looks like maybe the lid is falling from the
	I'm not sure . [+ exc] 42600_43954
	the lady is wiping a plate while the sink overflows . 43954_54269
	and she's standing in a puddle of water . 54269_58346
	am I going too fast ? [+ exc] 58346_61100
	and she's looking out the window . 63097_67064
	I can't make out anything in particular going on outside . [+ exc]
	<the water> [//] the faucet's turned on of_course which is causing
	and the water is splashing on the floor . 85829_88496
	that's really about all I can tell going on so to speak . [+ exc] 88496_100634
