	alright ? [+ exc] 0_3292
	mother's doing the dishes . 3557_4975
	the sink is overflowing . 4975_6534
	the &uh &uh stool is falling . 6534_9534
	the boy is going for the cookies . 9534_11097
	she's reaching out for him . 11097_12748
	&um the mother's looking out the window . 12748_16771
	sink is overflowing . [+ gram] 16771_18767
	&uh let's see . [+ exc] 18767_19580
	they use the sink . 19580_21160
	the boy reaching down to give her the cookie . [+ gram] 21160_24995
	I think that's it . [+ exc] 24995_27270
