	the boy's in the cookie jar but the stool is lopsided . 10334_21522
	he couldn't be standing like that . 21522_23641
	on a stool on two legs . [+ gram] 23641_26348
	and the mother's lettin(g) the water run over the sink . 26348_33788
	(...) well I assume she's already washed the plate that she's
	I don't know what else she is &=laughs . [+ exc] 53800_55700
	whether that would be mistake or not . [+ gram] [+ exc] 55700_61028
	(..) that's about all I can see there . [+ exc] 61028_70455
