	cookie jar . [+ gram] 3082_10259
	the boy and a girl and the ladder . [+ gram] 10259_13386
	the &uh cabinet . [+ gram] 13386_18539
	and the other cabinet with the sink in it <or with the> [//] yes .
	the water coming out . [+ gram] 25883_28233
	the sink . [+ gram] 28233_30428
	the dishes on the cabinet . [+ gram] 30428_33244
	the lady drying dishes . [+ gram] 33244_36107
	the window . [+ gram] 36107_37199
	and you can see the trees outside the window . 37199_41263
	the curtains on the window . [+ gram] 41263_45073
	the water . [+ gram] 54926_55904
	spilling over in the sink . [+ gram] 55904_59499
	I guess I mentioned the boy getting the cookies out_of the jar . 59499_66799
	oh yeah the ladder's tipping over . 76821_80700
	the boy's on the ladder and the ladder's tipping over . 80700_84310
	and the girl's reaching to get a cookie . 84310_87420
	and &uh the water's flowing down on the floor . 87420_93941
	you can see the grass out on the lawn . 93941_103344
