	okay a child falling off a stool in the attempt to reach the cookie
	and &uh maybe he's gonna drop the [/] the cookie . 13450_17374
	and his girl+friend is standing there beckoning him or reaching for
	and the mother is not paying any attention to the kids . 23583_27259
	she's looking out the window and &uh dryin(g) the dishes . 27249_31333
	at the same time she has let the sink &uh run over and the water is
	the curtains are waving and the window is open . 40265_46750
	and the yard looks like it's &uh manicured . 46750_54429
	and &uh other than the [/] the stool and the cabinets and the
