	+< alright . [+ exc] 2555_4201
	a boy is getting a cookie from the cookie jar . 4201_7660
	and the stool that he's standing on is falling over . 7660_11082
	the little girl is raising her hand reaching for some of the
	mother is doing the dishes obviously . 17308_21498
	and the water is running all over the floor &=laughs . 21498_24424
	&um (...) &hm let's see . [+ exc] 24424_34931
	(..) <I can't> [//] &remem <I guess or> [//] did I say the little
	okay let's see . [+ exc] 46830_50456
	&=sighs well socks are falling down &=laughs . 50456_56311
	I think that's about it . [+ exc] 56311_58815
