	now wait a minute . [+ exc] 3379_4095
	everything that's going on in the picture just by looking at it ?
	well
	and the boy is gettin(g) cookies out_of a jar . 10127_13784
	and he's on a stool . 13784_15247
	and there's cups over here . 15247_18074
	and the water's going on the floor . 18074_20203
	and the housewife
	and she's standing by the window . 24500_26724
	and &uh she's lettin(g) the water run out_of the faucet onto the
	and the [/] &k the ladder is fallin(g) over when he's gettin(g) the
	what else you want ? [+ exc] 37836_39799
