	okay
	I see he has the lid off . 8329_10258
	I see that he is standing on a three legged stool and he's about to
	he has one cookie in his hand
	and I think she's indicating to the boy to keep still so his mother
	I see the mother . 34297_37671
	&uh I guess she's drying the dishes and she's not paying attention
	and she must not be conscious because she's standing in it and
	&um &sh <I think she must> [//] I think she's probably lookin(g)
	and I see apparently a couple dirty dishes on the table+top . 62093_68593
	I see the cupboards . 68593_72782
	&uh I don't know whether they all have knobs on them or not . 72782_76439
	doesn't look like the two where the boy and the girl are have knobs
	and I see outside . 83305_86081
	I see &uh apparently it's a tree
	about it ? [+ exc] 93912_95559
